{"algorithm":"pinned-platt-pt21-one-sided-turing-inputs-flint-3.6-v1","block":0,"flint_commit":"8d5454b96761fafe4d5a9da76a369a602f500f49","inputs":{"lower":{"function":"turing_min","interval":{"a":9999999979,"b":10000000000},"values":{"im_gamma_integral":{"hi":{"denominator":1152921504606846976,"numerator":2582467952078921320163046411263},"lo":{"denominator":1152921504606846976,"numerator":2582467952078921320161432321121}},"log_pi":{"hi":{"denominator":85070591730234615865843651857942052864,"numerator":97382848760492398273272072446497772135},"lo":{"denominator":85070591730234615865843651857942052864,"numerator":97382848760492398273272072446497772133}},"pi":{"hi":{"denominator":42535295865117307932921825928971026432,"numerator":133628573008120843482460046645233847913},"lo":{"denominator":5316911983139663491615228241121378304,"numerator":16703571626015105435307505830654230989}},"s_bound":{"hi":{"denominator":85070591730234615865843651857942052864,"numerator":291411456164825203348486254589124710331},"lo":{"denominator":85070591730234615865843651857942052864,"numerator":291411456164825203348486254589124710323}}}},"upper":{"function":"turing_max","interval":{"a":10000001008,"b":10000001029},"values":{"im_gamma_integral":{"hi":{"denominator":576460752303423488,"numerator":1291234115135807453254550386997},"lo":{"denominator":576460752303423488,"numerator":1291234115135807453253743342009}},"log_pi":{"hi":{"denominator":85070591730234615865843651857942052864,"numerator":97382848760492398273272072446497772135},"lo":{"denominator":85070591730234615865843651857942052864,"numerator":97382848760492398273272072446497772133}},"pi":{"hi":{"denominator":42535295865117307932921825928971026432,"numerator":133628573008120843482460046645233847913},"lo":{"denominator":5316911983139663491615228241121378304,"numerator":16703571626015105435307505830654230989}},"s_bound":{"hi":{"denominator":85070591730234615865843651857942052864,"numerator":291411456681297246229427480465943883815},"lo":{"denominator":85070591730234615865843651857942052864,"numerator":291411456681297246229427480465943883807}}}}},"precision_bits":128,"replay_precision_bits":256,"required_sign_packet_sha256":"88f4d5a9305125cb185899d1fb000d8d68b0a098b38e0f9a7a87d63916a47f4d","schema":"sparkinterval.tg.platt-pt21-turing-inputs.v1","semantic_status":{"analytic_turing_realization_proved":false,"arb_interval_arithmetic_executed":true,"hardy_z_endpoint_realization_proved":false},"source_identity":{"height_lower":10000000000,"height_upper":10000001008,"interpolation_patch_sha256":"2bc33d3d4f6163ba5af8982f1272e9544154ed95bc6155a4ee215c4e425c85b3","source_turing_c_sha256":"07305e04e85477749ced09325c9e78388dd55d6107aa526d3becde345a430c27","upstream_commit":"42b21426718e542daa2b006dc05ea2d7f26426e6"}}
